{
  "$schema": "../schemas/digital-twin.schema.json",
  "schemaVersion": "0.1.0",
  "metadata": {
    "project": "Custom Gaming PC Build Manual",
    "siteUrl": "https://t3lstar.github.io/PC-Build/",
    "status": "published",
    "lastVerified": "2026-07-14 00:00 BST",
    "sourceAdr": "milestones/adr-0001-digital-twin-architecture.md",
    "notes": [
      "Milestone 6 issue #21 verified dataset for component identity, connector names, cable dependencies, airflow roles, build sequence, and BIOS training states.",
      "Exact interactive x/y coordinates remain future digital twin work and are deliberately marked partially verified or deferred where appropriate."
    ]
  },
  "components": [
    {
      "id": "cpu",
      "category": "cpu",
      "name": "AMD Ryzen 7 7800X3D",
      "model": "100-100000910WOF",
      "role": "AM5 gaming CPU installed in the motherboard socket.",
      "chapter": "src/content/docs/build-guide/cpu-installation.md",
      "manufacturerUrl": "https://www.amd.com/en/products/processors/desktops/ryzen/7000-series/amd-ryzen-7-7800x3d.html",
      "evidence": {
        "state": "verified",
        "sources": [
          {
            "type": "repository",
            "ref": "src/content/docs/appendix/bill-of-materials.md",
            "note": "Primary component list identifies the exact CPU and AM5 compatibility."
          }
        ]
      }
    },
    {
      "id": "cooler",
      "category": "cooler",
      "name": "ARCTIC Liquid Freezer III Pro 360",
      "model": "ACFRE00180A",
      "role": "360mm AIO liquid cooler mounted in the top radiator position.",
      "chapter": "src/content/docs/build-guide/aio-installation.md",
      "manufacturerUrl": "https://www.arctic.de/en/Liquid-Freezer-III-Pro-360/ACFRE00180A",
      "evidence": {
        "state": "verified",
        "sources": [
          {
            "type": "repository",
            "ref": "milestones/verification-register.md",
            "note": "AIO AM5 support, radiator dimensions, top-radiator compatibility, and acceptable cable paths are verified."
          }
        ]
      }
    },
    {
      "id": "motherboard",
      "category": "motherboard",
      "name": "Gigabyte B850 AORUS Elite WiFi7",
      "model": "B850 AORUS ELITE WIFI7 rev. 1.x",
      "role": "Central AM5 motherboard for CPU, memory, SSD, GPU, headers, and power connections.",
      "chapter": "src/content/docs/build-guide/motherboard-overview.md",
      "manufacturerUrl": "https://www.gigabyte.com/Motherboard/B850-AORUS-ELITE-WIFI7-rev-1x/sp",
      "evidence": {
        "state": "verified",
        "sources": [
          {
            "type": "repository",
            "ref": "milestones/verification-register.md",
            "note": "Motherboard connector/header inventory is verified for the static guide."
          }
        ]
      }
    },
    {
      "id": "memory",
      "category": "memory",
      "name": "G.SKILL Trident Z5 Neo RGB 32GB DDR5-6000 CL30",
      "model": "F5-6000J3038F16GX2-TZ5NR",
      "role": "Two-module AMD EXPO DDR5 kit installed in slots DDR5_A2 and DDR5_B2.",
      "chapter": "src/content/docs/build-guide/memory-installation.md",
      "manufacturerUrl": "https://www.gskill.com/product/165/390/1661410135/F5-6000J3038F16GX2-TZ5NR",
      "evidence": {
        "state": "verified",
        "sources": [
          {
            "type": "repository",
            "ref": "milestones/verification-register.md",
            "note": "G.SKILL QVL lists the motherboard for this locked kit and the manual verifies A2/B2 slot guidance."
          }
        ]
      }
    },
    {
      "id": "storage",
      "category": "storage",
      "name": "Samsung 990 PRO 2TB NVMe SSD",
      "model": "MZ-V9P2T0BW",
      "role": "M.2 2280 NVMe boot SSD installed in the preferred CPU-connected M2A_CPU slot.",
      "chapter": "src/content/docs/build-guide/m2-installation.md",
      "manufacturerUrl": "https://download.semiconductor.samsung.com/resources/data-sheet/samsung_nvme_ssd_990_pro_datasheet_rev.2.0.pdf",
      "evidence": {
        "state": "verified",
        "sources": [
          {
            "type": "repository",
            "ref": "milestones/verification-register.md",
            "note": "M2A_CPU is verified as the preferred CPU-connected M.2 slot for the boot NVMe SSD."
          }
        ]
      }
    },
    {
      "id": "gpu",
      "category": "gpu",
      "name": "Gigabyte Radeon RX 9060 XT Gaming OC 16GB",
      "model": "GV-R9060XTGAMING-OC-16GD",
      "role": "Primary graphics card installed in the motherboard primary PCIe x16 slot.",
      "chapter": "src/content/docs/build-guide/gpu-installation.md",
      "manufacturerUrl": "https://www.gigabyte.com/Graphics-Card/GV-R9060XTGAMING-OC-16GD/sp",
      "evidence": {
        "state": "verified",
        "sources": [
          {
            "type": "repository",
            "ref": "src/content/docs/appendix/bill-of-materials.md",
            "note": "Compatibility summary verifies GPU length, PCIe slot fit, and PSU capacity."
          }
        ]
      }
    },
    {
      "id": "case",
      "category": "case",
      "name": "Lian Li O11 Dynamic Mini V2 Flow",
      "model": "O11DMIV2FX",
      "role": "Case, airflow frame, radiator mount, and cable-routing enclosure.",
      "chapter": "src/content/docs/build-guide/case-overview.md",
      "manufacturerUrl": "https://lian-li.com/product/o11-dynamic-mini-v2/",
      "evidence": {
        "state": "verified",
        "sources": [
          {
            "type": "repository",
            "ref": "milestones/verification-register.md",
            "note": "Case fan count, ATX support, GPU clearance, PSU clearance, and top radiator support are verified for the static guide."
          }
        ]
      }
    },
    {
      "id": "psu",
      "category": "psu",
      "name": "ASUS TUF Gaming 1000W Gold",
      "model": "TUF-GAMING-1000G",
      "role": "Fully modular ATX power supply for motherboard, CPU, GPU, and optional accessory power.",
      "chapter": "src/content/docs/build-guide/psu-installation.md",
      "manufacturerUrl": "https://www.asus.com/us/motherboards-components/power-supply-units/tuf-gaming/tuf-gaming-1000g/techspec/",
      "evidence": {
        "state": "verified",
        "sources": [
          {
            "type": "repository",
            "ref": "src/content/docs/appendix/bill-of-materials.md",
            "note": "Compatibility summary verifies case clearance and power headroom."
          }
        ]
      }
    },
    {
      "id": "operating-system",
      "category": "operating-system",
      "name": "Windows 11 Pro",
      "model": "USB installation media",
      "role": "Operating system installed from an existing Windows 11 Pro USB installer.",
      "chapter": "src/content/docs/build-guide/windows-installation.md",
      "manufacturerUrl": "https://www.microsoft.com/en-us/software-download/windows11",
      "evidence": {
        "state": "verified",
        "sources": [
          {
            "type": "repository",
            "ref": "MILESTONES.md",
            "note": "Project assumptions state Windows 11 Pro installation media is already available on USB."
          }
        ]
      }
    }
  ],
  "locations": [
    {
      "id": "motherboard-top-left",
      "label": "Motherboard top-left CPU EPS area",
      "kind": "motherboard-zone",
      "staticFallback": "Area used for CPU EPS routing before top radiator final installation.",
      "evidence": {
        "state": "partially_verified",
        "sources": [
          {
            "type": "repository",
            "ref": "src/content/docs/appendix/connectors-cables.md",
            "note": "Connector identity is verified; exact digital twin coordinates remain pending."
          }
        ]
      }
    },
    {
      "id": "motherboard-right-edge",
      "label": "Motherboard right-edge 24-pin and USB area",
      "kind": "motherboard-zone",
      "staticFallback": "Right-edge cable entry zone for ATX 24-pin and front USB routing.",
      "evidence": {
        "state": "partially_verified",
        "sources": [
          {
            "type": "repository",
            "ref": "src/content/docs/appendix/connectors-cables.md",
            "note": "Connector names and routing guidance are verified; exact visual coordinates are future work."
          }
        ]
      }
    },
    {
      "id": "motherboard-bottom-edge",
      "label": "Motherboard bottom-edge front-panel area",
      "kind": "motherboard-zone",
      "staticFallback": "Bottom-edge zone for front-panel, front-audio, and lower utility leads.",
      "evidence": {
        "state": "partially_verified",
        "sources": [
          {
            "type": "repository",
            "ref": "milestones/verification-register.md",
            "note": "F_PANEL labels and polarity caution are verified; exact rendered map remains future work."
          }
        ]
      }
    },
    {
      "id": "motherboard-cpu-fan-area",
      "label": "CPU fan and pump header area",
      "kind": "header-area",
      "parentId": "motherboard",
      "staticFallback": "Header area used for the simple AIO all-in-one cable or optional individual-control leads.",
      "evidence": {
        "state": "partially_verified",
        "sources": [
          {
            "type": "repository",
            "ref": "milestones/verification-register.md",
            "note": "Acceptable headers are verified; exact x/y placement is future digital twin work."
          }
        ]
      }
    },
    {
      "id": "memory-slots-a2-b2",
      "label": "DDR5_A2 and DDR5_B2 memory slots",
      "kind": "slot",
      "parentId": "motherboard",
      "staticFallback": "Install the two memory modules in DDR5_A2 and DDR5_B2.",
      "evidence": {
        "state": "verified",
        "sources": [
          {
            "type": "repository",
            "ref": "milestones/verification-register.md",